{
  "$schema": "https://json-schema.org/draft/2020-12/schema",
  "$id": "knowledge-hub.paper.parsed-artifact-evidence-chunk-answer-path-labs-opt-in-quality-eval-seed.v1",
  "type": "object",
  "required": [
    "schema",
    "status",
    "generatedAt",
    "decision",
    "nextRecommendedTranche",
    "inputs",
    "policy",
    "qualityDimensions",
    "counts",
    "gate",
    "rows",
    "warnings"
  ],
  "additionalProperties": false,
  "properties": {
    "schema": {
      "const": "knowledge-hub.paper.parsed-artifact-evidence-chunk-answer-path-labs-opt-in-quality-eval-seed.v1"
    },
    "status": { "enum": ["ready", "blocked"] },
    "generatedAt": { "type": "string" },
    "decision": {
      "enum": [
        "parsed_artifact_evidence_chunk_answer_path_labs_opt_in_quality_eval_seed_ready",
        "parsed_artifact_evidence_chunk_answer_path_labs_opt_in_quality_eval_seed_blocked"
      ]
    },
    "nextRecommendedTranche": { "type": "string" },
    "inputs": {
      "type": "object",
      "required": [
        "labsSurfaceLiveSmokeReportRef",
        "labsSurfaceLiveSmokeSchema",
        "labsSurfaceLiveSmokeStatus",
        "labsSurfaceLiveSmokeDecision",
        "papersDirRef"
      ],
      "additionalProperties": false,
      "properties": {
        "labsSurfaceLiveSmokeReportRef": {
          "const": "eval/knowledgeos/reports/parsed_artifact_evidence_chunk_answer_path_labs_opt_in_surface_live_smoke.v1.json"
        },
        "labsSurfaceLiveSmokeSchema": { "type": "string" },
        "labsSurfaceLiveSmokeStatus": { "type": "string" },
        "labsSurfaceLiveSmokeDecision": { "type": "string" },
        "papersDirRef": { "const": "papers_dir" }
      }
    },
    "policy": {
      "type": "object",
      "required": [
        "reportOnly",
        "seedOnly",
        "labsOnly",
        "localFakeLlmOnly",
        "answerTextExcludedFromReport",
        "citationPayloadExcludedFromReport",
        "sourcePayloadExcludedFromReport",
        "excerptExcludedFromReport",
        "externalModelCallsAllowed",
        "judgeModelCallsAllowed",
        "candidateStoreWrites",
        "sourceSpanCreation",
        "strictEvidenceCreation",
        "runtimeDefaultChange"
      ],
      "additionalProperties": false,
      "properties": {
        "reportOnly": { "const": true },
        "seedOnly": { "const": true },
        "labsOnly": { "const": true },
        "localFakeLlmOnly": { "const": true },
        "answerTextExcludedFromReport": { "const": true },
        "citationPayloadExcludedFromReport": { "const": true },
        "sourcePayloadExcludedFromReport": { "const": true },
        "excerptExcludedFromReport": { "const": true },
        "externalModelCallsAllowed": { "const": false },
        "judgeModelCallsAllowed": { "const": false },
        "candidateStoreWrites": { "const": false },
        "sourceSpanCreation": { "const": false },
        "strictEvidenceCreation": { "const": false },
        "runtimeDefaultChange": { "const": false }
      }
    },
    "qualityDimensions": {
      "type": "array",
      "items": { "type": "string" },
      "minItems": 1
    },
    "counts": {
      "type": "object",
      "required": [
        "inputLiveSmokeRows",
        "liveSmokeReadyInputRows",
        "inputCaseRows",
        "attemptedCaseRows",
        "passRows",
        "failRows",
        "blockedRows",
        "expectedAnswerableRows",
        "expectedNoEvidenceRows",
        "observedAnswerableRows",
        "observedNoEvidenceRows",
        "positiveCasePassRows",
        "noEvidenceCasePassRows",
        "sourceCoveragePassRows",
        "evidenceTermCoveragePassRows",
        "surfacePayloadSchemaValidRows",
        "adapterAppliedRows",
        "adapterRowsAdded",
        "selectedEvidenceCount",
        "citationCount",
        "evidencePacketContractSpanRows",
        "localFakeLlmCallRows",
        "noEvidenceLlmCallRows",
        "candidateStoreWriteRows",
        "sourceSpanCreatedRows",
        "strictEvidenceRows",
        "citationGradeEvidenceRows",
        "runtimeEvidenceRows",
        "parserExecutionRows",
        "databaseMutationRows",
        "indexMutationRows",
        "reindexOrReembedRows",
        "canonicalParsedArtifactWriteRows",
        "vaultScanRows",
        "externalDownloadRows",
        "publicCliFlagRows",
        "defaultOnRows",
        "externalLlmCallRows",
        "modelApiCallRows",
        "judgeModelCallRows",
        "privatePathLeakRows",
        "schemaViolationCount"
      ],
      "additionalProperties": false,
      "properties": {
        "inputLiveSmokeRows": { "type": "integer", "minimum": 0 },
        "liveSmokeReadyInputRows": { "type": "integer", "minimum": 0 },
        "inputCaseRows": { "type": "integer", "minimum": 0 },
        "attemptedCaseRows": { "type": "integer", "minimum": 0 },
        "passRows": { "type": "integer", "minimum": 0 },
        "failRows": { "type": "integer", "minimum": 0 },
        "blockedRows": { "type": "integer", "minimum": 0 },
        "expectedAnswerableRows": { "type": "integer", "minimum": 0 },
        "expectedNoEvidenceRows": { "type": "integer", "minimum": 0 },
        "observedAnswerableRows": { "type": "integer", "minimum": 0 },
        "observedNoEvidenceRows": { "type": "integer", "minimum": 0 },
        "positiveCasePassRows": { "type": "integer", "minimum": 0 },
        "noEvidenceCasePassRows": { "type": "integer", "minimum": 0 },
        "sourceCoveragePassRows": { "type": "integer", "minimum": 0 },
        "evidenceTermCoveragePassRows": { "type": "integer", "minimum": 0 },
        "surfacePayloadSchemaValidRows": { "type": "integer", "minimum": 0 },
        "adapterAppliedRows": { "type": "integer", "minimum": 0 },
        "adapterRowsAdded": { "type": "integer", "minimum": 0 },
        "selectedEvidenceCount": { "type": "integer", "minimum": 0 },
        "citationCount": { "type": "integer", "minimum": 0 },
        "evidencePacketContractSpanRows": { "type": "integer", "minimum": 0 },
        "localFakeLlmCallRows": { "type": "integer", "minimum": 0 },
        "noEvidenceLlmCallRows": { "const": 0 },
        "candidateStoreWriteRows": { "const": 0 },
        "sourceSpanCreatedRows": { "const": 0 },
        "strictEvidenceRows": { "const": 0 },
        "citationGradeEvidenceRows": { "const": 0 },
        "runtimeEvidenceRows": { "const": 0 },
        "parserExecutionRows": { "const": 0 },
        "databaseMutationRows": { "const": 0 },
        "indexMutationRows": { "const": 0 },
        "reindexOrReembedRows": { "const": 0 },
        "canonicalParsedArtifactWriteRows": { "const": 0 },
        "vaultScanRows": { "const": 0 },
        "externalDownloadRows": { "const": 0 },
        "publicCliFlagRows": { "const": 0 },
        "defaultOnRows": { "const": 0 },
        "externalLlmCallRows": { "const": 0 },
        "modelApiCallRows": { "const": 0 },
        "judgeModelCallRows": { "const": 0 },
        "privatePathLeakRows": { "type": "integer", "minimum": 0 },
        "schemaViolationCount": { "type": "integer", "minimum": 0 }
      }
    },
    "gate": {
      "type": "object",
      "required": [
        "readyForLabsOptInQualityEvalRunner",
        "labsSurfaceLiveSmokeReady",
        "allSeedCasesPassed",
        "expectedNoEvidenceCasesStayedNoEvidence",
        "noEvidenceCasesAvoidedLlm",
        "semanticViolations"
      ],
      "additionalProperties": false,
      "properties": {
        "readyForLabsOptInQualityEvalRunner": { "type": "boolean" },
        "labsSurfaceLiveSmokeReady": { "type": "boolean" },
        "allSeedCasesPassed": { "type": "boolean" },
        "expectedNoEvidenceCasesStayedNoEvidence": { "type": "boolean" },
        "noEvidenceCasesAvoidedLlm": { "type": "boolean" },
        "semanticViolations": { "type": "array", "items": { "type": "string" } }
      }
    },
    "rows": {
      "type": "array",
      "items": {
        "type": "object",
        "required": [
          "caseId",
          "evalFocus",
          "question",
          "paperIds",
          "expectedStatus",
          "observedStatus",
          "expectedAnswerable",
          "observedAnswerable",
          "expectedSourceIds",
          "observedSourceIds",
          "missingSourceIds",
          "requiredEvidenceTerms",
          "observedEvidenceTerms",
          "missingEvidenceTerms",
          "adapterStatus",
          "adapterRowsAdded",
          "adapterCandidateRowsConsidered",
          "selectedEvidenceCount",
          "citationCount",
          "evidencePacketContractSpanRows",
          "localFakeLlmCallRows",
          "schemaValid",
          "answerTextHash",
          "answerTextIncludedInReport",
          "citationPayloadIncludedInReport",
          "sourcePayloadIncludedInReport",
          "excerptIncludedInReport",
          "candidateRecordIds",
          "failureReasons",
          "pass"
        ],
        "additionalProperties": false,
        "properties": {
          "caseId": { "type": "string" },
          "evalFocus": { "type": "string" },
          "question": { "type": "string" },
          "paperIds": { "type": "array", "items": { "type": "string" } },
          "expectedStatus": { "enum": ["ok", "no_evidence"] },
          "observedStatus": { "type": "string" },
          "expectedAnswerable": { "type": "boolean" },
          "observedAnswerable": { "type": "boolean" },
          "expectedSourceIds": { "type": "array", "items": { "type": "string" } },
          "observedSourceIds": { "type": "array", "items": { "type": "string" } },
          "missingSourceIds": { "type": "array", "items": { "type": "string" } },
          "requiredEvidenceTerms": { "type": "array", "items": { "type": "string" } },
          "observedEvidenceTerms": { "type": "array", "items": { "type": "string" } },
          "missingEvidenceTerms": { "type": "array", "items": { "type": "string" } },
          "adapterStatus": { "type": "string" },
          "adapterRowsAdded": { "type": "integer", "minimum": 0 },
          "adapterCandidateRowsConsidered": { "type": "integer", "minimum": 0 },
          "selectedEvidenceCount": { "type": "integer", "minimum": 0 },
          "citationCount": { "type": "integer", "minimum": 0 },
          "evidencePacketContractSpanRows": { "type": "integer", "minimum": 0 },
          "localFakeLlmCallRows": { "type": "integer", "minimum": 0 },
          "schemaValid": { "type": "boolean" },
          "answerTextHash": { "type": "string" },
          "answerTextIncludedInReport": { "const": false },
          "citationPayloadIncludedInReport": { "const": false },
          "sourcePayloadIncludedInReport": { "const": false },
          "excerptIncludedInReport": { "const": false },
          "candidateRecordIds": { "type": "array", "items": { "type": "string" } },
          "failureReasons": { "type": "array", "items": { "type": "string" } },
          "pass": { "type": "boolean" }
        }
      }
    },
    "warnings": { "type": "array", "items": { "type": "string" } }
  }
}
