{
  "schema": "knowledge-hub.paper.parsed-artifact-evidence-chunk-answer-path-labs-opt-in-quality-eval-seed.v1",
  "status": "ready",
  "generatedAt": "2026-05-28T20:59:48Z",
  "decision": "parsed_artifact_evidence_chunk_answer_path_labs_opt_in_quality_eval_seed_ready",
  "nextRecommendedTranche": "parsed_artifact_evidence_chunk_answer_path_labs_opt_in_quality_eval_runner",
  "inputs": {
    "labsSurfaceLiveSmokeReportRef": "eval/knowledgeos/reports/parsed_artifact_evidence_chunk_answer_path_labs_opt_in_surface_live_smoke.v1.json",
    "labsSurfaceLiveSmokeSchema": "knowledge-hub.paper.parsed-artifact-evidence-chunk-answer-path-labs-opt-in-surface-live-smoke.v1",
    "labsSurfaceLiveSmokeStatus": "ready",
    "labsSurfaceLiveSmokeDecision": "parsed_artifact_evidence_chunk_answer_path_labs_opt_in_surface_live_smoke_ready",
    "papersDirRef": "papers_dir"
  },
  "policy": {
    "reportOnly": true,
    "seedOnly": true,
    "labsOnly": true,
    "localFakeLlmOnly": true,
    "answerTextExcludedFromReport": true,
    "citationPayloadExcludedFromReport": true,
    "sourcePayloadExcludedFromReport": true,
    "excerptExcludedFromReport": true,
    "externalModelCallsAllowed": false,
    "judgeModelCallsAllowed": false,
    "candidateStoreWrites": false,
    "sourceSpanCreation": false,
    "strictEvidenceCreation": false,
    "runtimeDefaultChange": false
  },
  "qualityDimensions": [
    "answerability_expectation",
    "evidence_term_support",
    "source_coverage",
    "citation_and_span_presence",
    "expected_no_evidence_safety"
  ],
  "counts": {
    "inputLiveSmokeRows": 1,
    "liveSmokeReadyInputRows": 1,
    "inputCaseRows": 4,
    "attemptedCaseRows": 4,
    "passRows": 4,
    "failRows": 0,
    "blockedRows": 0,
    "expectedAnswerableRows": 3,
    "expectedNoEvidenceRows": 1,
    "observedAnswerableRows": 3,
    "observedNoEvidenceRows": 1,
    "positiveCasePassRows": 3,
    "noEvidenceCasePassRows": 1,
    "sourceCoveragePassRows": 4,
    "evidenceTermCoveragePassRows": 4,
    "surfacePayloadSchemaValidRows": 4,
    "adapterAppliedRows": 3,
    "adapterRowsAdded": 8,
    "selectedEvidenceCount": 8,
    "citationCount": 8,
    "evidencePacketContractSpanRows": 8,
    "localFakeLlmCallRows": 3,
    "noEvidenceLlmCallRows": 0,
    "candidateStoreWriteRows": 0,
    "sourceSpanCreatedRows": 0,
    "strictEvidenceRows": 0,
    "citationGradeEvidenceRows": 0,
    "runtimeEvidenceRows": 0,
    "parserExecutionRows": 0,
    "databaseMutationRows": 0,
    "indexMutationRows": 0,
    "reindexOrReembedRows": 0,
    "canonicalParsedArtifactWriteRows": 0,
    "vaultScanRows": 0,
    "externalDownloadRows": 0,
    "publicCliFlagRows": 0,
    "defaultOnRows": 0,
    "externalLlmCallRows": 0,
    "modelApiCallRows": 0,
    "judgeModelCallRows": 0,
    "privatePathLeakRows": 0,
    "schemaViolationCount": 0
  },
  "gate": {
    "readyForLabsOptInQualityEvalRunner": true,
    "labsSurfaceLiveSmokeReady": true,
    "allSeedCasesPassed": true,
    "expectedNoEvidenceCasesStayedNoEvidence": true,
    "noEvidenceCasesAvoidedLlm": true,
    "semanticViolations": []
  },
  "rows": [
    {
      "caseId": "alphafold_protein_structure_seed",
      "evalFocus": "single_paper_section_paragraph_evidence",
      "question": "What parsed section or paragraph evidence is available about AlphaFold protein structure prediction?",
      "paperIds": [
        "1207.0580"
      ],
      "expectedStatus": "ok",
      "observedStatus": "ok",
      "expectedAnswerable": true,
      "observedAnswerable": true,
      "expectedSourceIds": [
        "1207.0580"
      ],
      "observedSourceIds": [
        "1207.0580"
      ],
      "missingSourceIds": [],
      "requiredEvidenceTerms": [
        "AlphaFold",
        "protein",
        "structure"
      ],
      "observedEvidenceTerms": [
        "AlphaFold",
        "protein",
        "structure"
      ],
      "missingEvidenceTerms": [],
      "adapterStatus": "applied",
      "adapterRowsAdded": 2,
      "adapterCandidateRowsConsidered": 4,
      "selectedEvidenceCount": 2,
      "citationCount": 2,
      "evidencePacketContractSpanRows": 2,
      "localFakeLlmCallRows": 1,
      "schemaValid": true,
      "answerTextHash": "sha256:8bfd50b59618894987f5181e391e11e06d69bb351230ee7223c61bfdcfddbe1f",
      "answerTextIncludedInReport": false,
      "citationPayloadIncludedInReport": false,
      "sourcePayloadIncludedInReport": false,
      "excerptIncludedInReport": false,
      "candidateRecordIds": [
        "parsed-artifact-evidence-chunk-candidate:1207.0580:paragraph:cedd251525d1e551",
        "parsed-artifact-evidence-chunk-candidate:1207.0580:paragraph:fa5b9bc54ceb0f03"
      ],
      "failureReasons": [],
      "pass": true
    },
    {
      "caseId": "word_vectors_similarity_seed",
      "evalFocus": "single_paper_section_paragraph_evidence",
      "question": "What parsed section or paragraph evidence is available about continuous word representations?",
      "paperIds": [
        "1301.3781"
      ],
      "expectedStatus": "ok",
      "observedStatus": "ok",
      "expectedAnswerable": true,
      "observedAnswerable": true,
      "expectedSourceIds": [
        "1301.3781"
      ],
      "observedSourceIds": [
        "1301.3781"
      ],
      "missingSourceIds": [],
      "requiredEvidenceTerms": [
        "continuous",
        "vector",
        "word",
        "similarity"
      ],
      "observedEvidenceTerms": [
        "continuous",
        "vector",
        "word",
        "similarity"
      ],
      "missingEvidenceTerms": [],
      "adapterStatus": "applied",
      "adapterRowsAdded": 2,
      "adapterCandidateRowsConsidered": 4,
      "selectedEvidenceCount": 2,
      "citationCount": 2,
      "evidencePacketContractSpanRows": 2,
      "localFakeLlmCallRows": 1,
      "schemaValid": true,
      "answerTextHash": "sha256:8bfd50b59618894987f5181e391e11e06d69bb351230ee7223c61bfdcfddbe1f",
      "answerTextIncludedInReport": false,
      "citationPayloadIncludedInReport": false,
      "sourcePayloadIncludedInReport": false,
      "excerptIncludedInReport": false,
      "candidateRecordIds": [
        "parsed-artifact-evidence-chunk-candidate:1301.3781:paragraph:266306157ad5395f",
        "parsed-artifact-evidence-chunk-candidate:1301.3781:section:b6b0e5463a6bf99d"
      ],
      "failureReasons": [],
      "pass": true
    },
    {
      "caseId": "resolved_pair_compare_seed",
      "evalFocus": "two_paper_compare_seed",
      "question": "Compare available parsed evidence for the AlphaFold and word vector papers.",
      "paperIds": [
        "1207.0580",
        "1301.3781"
      ],
      "expectedStatus": "ok",
      "observedStatus": "ok",
      "expectedAnswerable": true,
      "observedAnswerable": true,
      "expectedSourceIds": [
        "1207.0580",
        "1301.3781"
      ],
      "observedSourceIds": [
        "1207.0580",
        "1301.3781"
      ],
      "missingSourceIds": [],
      "requiredEvidenceTerms": [
        "AlphaFold",
        "CASP14",
        "continuous",
        "similarity"
      ],
      "observedEvidenceTerms": [
        "AlphaFold",
        "CASP14",
        "continuous",
        "similarity"
      ],
      "missingEvidenceTerms": [],
      "adapterStatus": "applied",
      "adapterRowsAdded": 4,
      "adapterCandidateRowsConsidered": 8,
      "selectedEvidenceCount": 4,
      "citationCount": 4,
      "evidencePacketContractSpanRows": 4,
      "localFakeLlmCallRows": 1,
      "schemaValid": true,
      "answerTextHash": "sha256:8bfd50b59618894987f5181e391e11e06d69bb351230ee7223c61bfdcfddbe1f",
      "answerTextIncludedInReport": false,
      "citationPayloadIncludedInReport": false,
      "sourcePayloadIncludedInReport": false,
      "excerptIncludedInReport": false,
      "candidateRecordIds": [
        "parsed-artifact-evidence-chunk-candidate:1207.0580:paragraph:cedd251525d1e551",
        "parsed-artifact-evidence-chunk-candidate:1207.0580:paragraph:fa5b9bc54ceb0f03",
        "parsed-artifact-evidence-chunk-candidate:1301.3781:paragraph:266306157ad5395f",
        "parsed-artifact-evidence-chunk-candidate:1301.3781:section:b6b0e5463a6bf99d"
      ],
      "failureReasons": [],
      "pass": true
    },
    {
      "caseId": "missing_candidate_store_no_evidence_seed",
      "evalFocus": "expected_no_evidence_safety",
      "question": "What parsed section or paragraph evidence is available for this missing paper?",
      "paperIds": [
        "missing-paper-id"
      ],
      "expectedStatus": "no_evidence",
      "observedStatus": "no_evidence",
      "expectedAnswerable": false,
      "observedAnswerable": false,
      "expectedSourceIds": [],
      "observedSourceIds": [],
      "missingSourceIds": [],
      "requiredEvidenceTerms": [],
      "observedEvidenceTerms": [],
      "missingEvidenceTerms": [],
      "adapterStatus": "skipped",
      "adapterRowsAdded": 0,
      "adapterCandidateRowsConsidered": 0,
      "selectedEvidenceCount": 0,
      "citationCount": 0,
      "evidencePacketContractSpanRows": 0,
      "localFakeLlmCallRows": 0,
      "schemaValid": true,
      "answerTextHash": "sha256:8c5390cf89d071a7b4503895ed2c4afe98d4af55d42626d845eb56feaf67e612",
      "answerTextIncludedInReport": false,
      "citationPayloadIncludedInReport": false,
      "sourcePayloadIncludedInReport": false,
      "excerptIncludedInReport": false,
      "candidateRecordIds": [],
      "failureReasons": [],
      "pass": true
    }
  ],
  "warnings": [
    "seed_cases_define_a_minimal_quality_eval_starting_set_not_a_full_quality_benchmark",
    "answer_text_citations_sources_and_raw_excerpts_are_not_included_in_this_report"
  ]
}
